{
  "schema": "operatebench.runtime_identity_adapter_registry.v1",
  "schema_version": 1,
  "manifest_authority": "adapter_output_only",
  "source_commit_eligibility": "content_addressed_not_commit_pinned",
  "initial_implementation_support": "deterministic_reference_fresh_after_projectors_and_build_descriptor",
  "current_complete_lanes": [],
  "arm_default": null,
  "outcome_inference_authorized": false,
  "arbitrary_injected_agents_supported": false,
  "freeze_manifest_sha256": "6ec8409ca55dc4fbb0f5d9078f25004429edd6525209d1e8080b163b36a2b8c9",
  "owners": [
    {
      "owner": "operation_core_content",
      "authoritative_source": "operatebench.domains.lettings.maintenance.spec.load_spec(examples/operatebench/maintenance_v0_1.yaml) then OperationSpec.verify_identity(); live OperationSpec.identity_payload(), action_schema_view(), maintenance_action_evidence_contract(), and maintenance_retrieval_catalogue()",
      "authoritative_source_leaves": [
        "examples/operatebench/maintenance_v0_1.yaml",
        "operatebench.domains.lettings.maintenance.retrieval.maintenance_retrieval_catalogue",
        "operatebench.domains.lettings.maintenance.spec.OperationSpec.action_schema_view",
        "operatebench.domains.lettings.maintenance.spec.OperationSpec.identity_payload",
        "operatebench.domains.lettings.maintenance.spec.OperationSpec.verify_identity",
        "operatebench.domains.lettings.maintenance.spec.load_spec",
        "operatebench.domains.lettings.maintenance.spec.maintenance_action_evidence_contract"
      ],
      "projector_contract": "operatebench.domains.lettings.maintenance.identity_projectors.project_operation_card_v1 (required future production output; absent in this contract-only slice)",
      "card_schema": "src/operatebench/resources/cards/operation-card-v1.schema.json",
      "projection_pointers": [
        "/operation_card/schema",
        "/operation_card/schema_version",
        "/operation_card/id",
        "/operation_card/content_digest_sha256",
        "/operation_card/content/operation_type",
        "/operation_card/content/operation_version",
        "/operation_card/content/state_contract",
        "/operation_card/content/authority_contract",
        "/operation_card/content/policy_contract",
        "/operation_card/content/event_contracts",
        "/operation_card/content/action_contracts",
        "/operation_card/content/retrieval_contract",
        "/operation_card/content/transition_contract"
      ],
      "dependency_bindings": [],
      "selected_run_cross_bindings": [
        "OperationSpec.identity_payload() equals Artifact8 /operation and verified spec_digest_sha256 equals Artifact8 /operation/spec_digest_sha256",
        "projected card id/type/version/policy equal the selected verified OperationSpec",
        "every leaf is owned exactly once by the B1 identity-field census"
      ],
      "support_status": "blocked_projector_unimplemented"
    },
    {
      "owner": "semantic_scenario_content",
      "authoritative_source": "operatebench.domains.lettings.maintenance.semantic_arms_v1.maintenance_v1_semantic_scenario(spec), SemanticScenario.verify_identity(), and SemanticScenario.semantic_payload()",
      "authoritative_source_leaves": [
        "operatebench.domains.lettings.maintenance.semantic_arms_v1.SemanticScenario.semantic_payload",
        "operatebench.domains.lettings.maintenance.semantic_arms_v1.SemanticScenario.verify_identity",
        "operatebench.domains.lettings.maintenance.semantic_arms_v1.maintenance_v1_semantic_scenario"
      ],
      "projector_contract": "operatebench.domains.lettings.maintenance.identity_projectors.project_semantic_scenario_card_v1 (required future production output; absent in this contract-only slice)",
      "card_schema": "src/operatebench/resources/cards/semantic-scenario-card-v1.schema.json",
      "projection_pointers": [
        "/semantic_scenario_card/schema",
        "/semantic_scenario_card/schema_version",
        "/semantic_scenario_card/id",
        "/semantic_scenario_card/content_digest_sha256",
        "/semantic_scenario_card/content/operation_core",
        "/semantic_scenario_card/content/construct_label",
        "/semantic_scenario_card/content/common_estimand_id",
        "/semantic_scenario_card/content/decision_points",
        "/semantic_scenario_card/content/causal_graph",
        "/semantic_scenario_card/content/authored_hazards",
        "/semantic_scenario_card/content/common_outcome_obligations",
        "/semantic_scenario_card/content/allowed_variant_dimensions"
      ],
      "dependency_bindings": [
        {
          "requires_owner": "operation_core_content",
          "binds_pointer": "/operation_card/id",
          "binding": "the projected operation_core reference names the accepted operation card, which operation_core_content owns"
        },
        {
          "requires_owner": "operation_core_content",
          "binds_pointer": "/operation_card/content_digest_sha256",
          "binding": "the projected operation_core reference carries the accepted operation card content digest, which operation_core_content owns"
        }
      ],
      "selected_run_cross_bindings": [
        "selected semantic scenario id equals OperationSpec.semantic_scenario_id, Artifact8 /semantic_scenario_id, and Artifact8 /operation/semantic_scenario_id",
        "operation id and digest reference the accepted operation card",
        "compile_maintenance_v1 accepts the exact verified semantic source with contiguous point order"
      ],
      "support_status": "blocked_projector_unimplemented"
    },
    {
      "owner": "variant_content",
      "authoritative_source": "OperationSpec.scenario(selected scenario_id) and ScenarioSpec.semantic_payload() plus OperationSpec.actor_snapshot(), hidden_state_snapshot(), and message_fixture_snapshot() only where required by the B1 card",
      "authoritative_source_leaves": [
        "operatebench.domains.lettings.maintenance.spec.OperationSpec.actor_snapshot",
        "operatebench.domains.lettings.maintenance.spec.OperationSpec.hidden_state_snapshot",
        "operatebench.domains.lettings.maintenance.spec.OperationSpec.message_fixture_snapshot",
        "operatebench.domains.lettings.maintenance.spec.OperationSpec.scenario",
        "operatebench.domains.lettings.maintenance.spec.ScenarioSpec.semantic_payload"
      ],
      "projector_contract": "operatebench.domains.lettings.maintenance.identity_projectors.project_variant_card_v1 (required future production output; absent in this contract-only slice)",
      "card_schema": "src/operatebench/resources/cards/variant-card-v1.schema.json",
      "projection_pointers": [
        "/variant_card/schema",
        "/variant_card/schema_version",
        "/variant_card/id",
        "/variant_card/content_digest_sha256",
        "/variant_card/content/semantic_scenario",
        "/variant_card/content/variant_label",
        "/variant_card/content/starts_at",
        "/variant_card/content/expected_terminal",
        "/variant_card/content/human_checkpoint_budget",
        "/variant_card/content/required_checkpoint_types",
        "/variant_card/content/dispatch_failures",
        "/variant_card/content/expected_event_rejections",
        "/variant_card/content/actors",
        "/variant_card/content/hidden_initial_values",
        "/variant_card/content/message_fixtures",
        "/variant_card/content/events"
      ],
      "dependency_bindings": [
        {
          "requires_owner": "semantic_scenario_content",
          "binds_pointer": "/semantic_scenario_card/id",
          "binding": "the projected semantic_scenario reference names the accepted semantic scenario card, which semantic_scenario_content owns"
        },
        {
          "requires_owner": "semantic_scenario_content",
          "binds_pointer": "/semantic_scenario_card/content_digest_sha256",
          "binding": "the projected semantic_scenario reference carries the accepted semantic scenario card content digest, which semantic_scenario_content owns"
        }
      ],
      "selected_run_cross_bindings": [
        "Artifact8 /scenario_id selects exactly one ScenarioSpec and equals the projected variant id",
        "semantic scenario reference equals the accepted semantic scenario card",
        "label and expected terminal equal Artifact8 /scenario_label and /expected_terminal; actors/events/fixtures resolve against OperationSpec"
      ],
      "support_status": "blocked_projector_unimplemented"
    },
    {
      "owner": "runtime_contract_content",
      "authoritative_source": "operatebench.version.OPERATEBENCH_VERSION; operatebench.artifact.ARTIFACT_VERSION; operatebench.agents.model MODEL_PROTOCOL_VERSION and tool_schema; operatebench.core.protocol MODEL_VISIBLE_FIELDS/model_projection; MAINTENANCE_WAKE_EVENT_TYPES; Engine and MaintenanceOperation identifiers",
      "authoritative_source_leaves": [
        "operatebench.agents.model.MODEL_PROTOCOL_VERSION",
        "operatebench.agents.model.tool_schema",
        "operatebench.artifact.ARTIFACT_VERSION",
        "operatebench.core.engine.Engine",
        "operatebench.core.protocol.MODEL_VISIBLE_FIELDS",
        "operatebench.core.protocol.model_projection",
        "operatebench.domains.lettings.maintenance.operation.MaintenanceOperation",
        "operatebench.domains.lettings.maintenance.spec.MAINTENANCE_WAKE_EVENT_TYPES",
        "operatebench.version.OPERATEBENCH_VERSION"
      ],
      "projector_contract": "future private runtime-manifest adapter projection after B1 projectors",
      "card_schema": null,
      "projection_pointers": [
        "/runtime_contract/engine_version",
        "/runtime_contract/artifact_version",
        "/runtime_contract/model_protocol_version",
        "/runtime_contract/model_visible_fields",
        "/runtime_contract/outcome_tool_schema",
        "/runtime_contract/wake_event_types",
        "/runtime_contract/engine_class",